{
  "_about": "Nội dung website Lotus. Sửa qua trang /admin. *chữ* = in nghiêng, xuống dòng = ngắt dòng.",
  "site": {
    "title": {
      "vi": "Lotus Global Immigration — Vươn xa từ điều bạn Yêu.",
      "en": "Lotus Global Immigration — Go further with what you Love."
    },
    "description": {
      "vi": "Lotus đồng hành cùng bạn học healthcare và làm đẹp tại Singapore — nền tảng để từng bước hướng tới cơ hội nghề nghiệp tại Mỹ, Canada, Châu Âu và một tương lai rộng mở hơn cho cả gia đình.",
      "en": "Study healthcare or beauty in Singapore with Lotus — a foundation for working towards careers in the USA, Canada and Europe, and a brighter future for your whole family."
    },
    "hotline": "0879.769.569",
    "zalo": "0879769569",
    "logo": "assets/logo-lotus-bright.png",
    "icon": "assets/logo-lotus-bright.png"
  },
  "announcement": {
    "enabled": false,
    "text": {
      "vi": "",
      "en": ""
    },
    "link_label": {
      "vi": "Xem thêm",
      "en": "Learn more"
    },
    "link": "#ket-noi"
  },
  "nav": {
    "about": {
      "vi": "Về Lotus",
      "en": "About Lotus"
    },
    "fields": {
      "vi": "Lĩnh vực",
      "en": "Our fields"
    },
    "careers": {
      "vi": "Nghề nghiệp",
      "en": "Careers"
    },
    "destinations": {
      "vi": "Điểm đến",
      "en": "Destinations"
    },
    "journey": {
      "vi": "Hành trình",
      "en": "Your journey"
    },
    "cta": {
      "vi": "Bắt đầu hành trình",
      "en": "Start your journey"
    }
  },
  "hero": {
    "eyebrow": {
      "vi": "LOTUS GLOBAL IMMIGRATION",
      "en": "LOTUS GLOBAL IMMIGRATION"
    },
    "title": {
      "vi": "Vươn xa từ\nđiều bạn *Yêu.*",
      "en": "Go further with\nwhat you *Love.*"
    },
    "description": {
      "vi": "Như đóa sen vươn lên khỏi mặt hồ, mỗi sự nghiệp lớn đều lớn lên từ một gốc rễ vững vàng. Học healthcare hoặc làm đẹp tại Singapore — rồi từng bước hướng tới cơ hội nghề nghiệp quốc tế và một tương lai rộng mở hơn cho cả gia đình.",
      "en": "Like a lotus rising above the water, every great career grows from strong roots. Study healthcare or beauty in Singapore — then, step by step, work towards international opportunities and a brighter future for your whole family."
    },
    "button": {
      "vi": "Tìm hướng đi dành cho bạn",
      "en": "Find your path"
    },
    "badge": {
      "vi": "HEALTHCARE & BEAUTY",
      "en": "HEALTHCARE & BEAUTY"
    },
    "places": {
      "vi": "Singapore · USA · Canada · Châu Âu",
      "en": "Singapore · USA · Canada · Europe"
    },
    "image": {
      "src": "assets/beauty-aspiration-smile.jpg",
      "alt": {
        "vi": "Người mẫu minh họa cô gái trẻ với khát vọng phát triển chuyên môn Beauty & Wellness",
        "en": "Illustrative model aspiring to a career in Beauty & Wellness"
      }
    },
    "image_top": {
      "vi": "YOUR BEAUTY. YOUR FUTURE.",
      "en": "YOUR BEAUTY. YOUR FUTURE."
    },
    "image_quote": {
      "vi": "Từ đam mê làm đẹp.\n*Đến tương lai bạn Yêu.*",
      "en": "From a passion for beauty.\n*To a future you Love.*"
    },
    "image_caption": {
      "vi": "BEAUTY & WELLNESS\nKHỞI ĐẦU HÀNH TRÌNH CHUYÊN MÔN",
      "en": "BEAUTY & WELLNESS\nBEGIN YOUR PROFESSIONAL JOURNEY"
    }
  },
  "ribbon": [
    {
      "vi": "Tận tâm với con người.",
      "en": "Devoted to people."
    },
    {
      "vi": "Trân trọng đam mê.",
      "en": "Honour your passion."
    },
    {
      "vi": "Vươn tới thế giới.",
      "en": "Reach for the world."
    }
  ],
  "intro": {
    "eyebrow": {
      "vi": "01 — TINH THẦN LOTUS",
      "en": "01 — THE LOTUS SPIRIT"
    },
    "title": {
      "vi": "Sen không chọn nơi mọc.\nNhưng sen luôn chọn *vươn lên.*",
      "en": "A lotus doesn’t choose where it grows.\nBut it always chooses *to rise.*"
    },
    "paragraphs": [
      {
        "vi": "Lotus mang tên loài hoa gắn bó nhất với người Việt: bắt rễ trong bùn, vươn qua mặt nước và nở rộ dưới ánh mặt trời. Chúng tôi tin mỗi người trẻ cũng vậy — dù bắt đầu từ đâu, bạn đều có thể lớn lên bằng chính nghề nghiệp mình yêu.",
        "en": "Lotus is named after the flower closest to Vietnamese hearts: rooted in mud, rising through water, blooming in the sun. We believe every young person can do the same — wherever you begin, you can grow through a career you truly love."
      },
      {
        "vi": "Chúng tôi chọn đồng hành trong hai lĩnh vực mang giá trị chăm sóc con người — healthcare và làm đẹp — tại Singapore, Mỹ, Canada và Châu Âu. Mọi lộ trình đều bắt đầu từ năng lực, mong muốn và hoàn cảnh thật của bạn, không phải từ một khuôn mẫu có sẵn.",
        "en": "We focus on two fields devoted to caring for people — healthcare and beauty — across Singapore, the USA, Canada and Europe. Every pathway starts from your real abilities, hopes and circumstances, never from a one-size-fits-all template."
      }
    ],
    "image": {
      "src": "assets/lotus-spirit-smile.jpg",
      "alt": {
        "vi": "Người mẫu minh họa nâng niu đóa sen hồng hé nở",
        "en": "Illustrative model gently holding a pink lotus blossom"
      }
    }
  },
  "launchpad": {
    "eyebrow": {
      "vi": "SINGAPORE — BỆ PHÓNG TOÀN CẦU",
      "en": "SINGAPORE — YOUR GLOBAL LAUNCHPAD"
    },
    "title": {
      "vi": "Học ở Singapore.\n*Nghĩ xa hơn Singapore.*",
      "en": "Study in Singapore.\n*Think beyond it.*"
    },
    "paragraphs": [
      {
        "vi": "Singapore mang đến môi trường học bằng tiếng Anh, chuẩn mực quốc tế, chỉ cách Việt Nam khoảng hai giờ bay. Bằng cấp và tay nghề bạn tích lũy tại đây có thể trở thành bệ phóng để hướng tới vị trí chuyên môn tại Mỹ, Canada và Châu Âu.",
        "en": "Singapore offers English-language study to international standards, only about two hours’ flight from Vietnam. The qualifications and hands-on skills you build here can become your launchpad towards professional roles in the USA, Canada and Europe."
      },
      {
        "vi": "Và bạn không bước đi một mình. Lotus cùng bạn tìm hiểu hướng làm việc lâu dài và khả năng đưa gia đình cùng đi — dựa trên chương trình phù hợp và điều kiện thực tế của từng thành viên.",
        "en": "And you won’t walk alone. Lotus helps you explore long-term career options and the possibility of bringing your family — based on suitable programmes and each member’s real eligibility."
      }
    ],
    "button": {
      "vi": "Vẽ hành trình của gia đình bạn",
      "en": "Plan your family’s journey"
    },
    "route_kicker": {
      "vi": "YOUR GLOBAL JOURNEY",
      "en": "YOUR GLOBAL JOURNEY"
    },
    "origin_label": {
      "vi": "HỌC TẬP & NÂNG CAO CHUYÊN MÔN",
      "en": "STUDY & PROFESSIONAL DEVELOPMENT"
    },
    "origin": {
      "vi": "Singapore",
      "en": "Singapore"
    },
    "origin_sub": {
      "vi": "Healthcare · Beauty & Wellness",
      "en": "Healthcare · Beauty & Wellness"
    },
    "targets": [
      {
        "name": {
          "vi": "Mỹ (USA)",
          "en": "USA"
        },
        "sub": {
          "vi": "Mỹ",
          "en": "United States"
        }
      },
      {
        "name": {
          "vi": "Canada",
          "en": "Canada"
        },
        "sub": {
          "vi": "Bắc Mỹ",
          "en": "North America"
        }
      },
      {
        "name": {
          "vi": "Châu Âu",
          "en": "Europe"
        },
        "sub": {
          "vi": "Châu Âu",
          "en": "Europe"
        }
      }
    ],
    "route_caption": {
      "vi": "Học tập → Phát triển nghề nghiệp → Tìm hiểu định cư cùng gia đình",
      "en": "Study → Career development → Explore family immigration"
    },
    "notice": {
      "vi": "Minh bạch là cam kết của Lotus: khả năng ứng tuyển, hành nghề, xin thị thực và định cư phụ thuộc vào bằng cấp cụ thể, việc công nhận chuyên môn, ngoại ngữ và quy định tại điểm đến. Bằng cấp Singapore không tự động bảo đảm việc làm, giấy phép hành nghề hoặc quyền định cư cho bạn và gia đình.",
      "en": "Transparency is our promise: eligibility for employment, professional practice, visas and immigration depends on your specific qualifications, professional recognition, language skills and destination requirements. A Singapore qualification does not automatically guarantee employment, professional licensing or immigration rights for you or your family."
    },
    "links_title": {
      "vi": "Tham khảo yêu cầu công nhận chuyên môn",
      "en": "Professional recognition requirements"
    },
    "links": [
      {
        "label": {
          "vi": "Mỹ — đánh giá bằng cấp y tế",
          "en": "USA — healthcare credential assessment"
        },
        "url": "https://www.cgfns.org/services/certification/visascreen-visa-credentials-assessment/"
      },
      {
        "label": {
          "vi": "Canada — công nhận bằng cấp",
          "en": "Canada — foreign credential recognition"
        },
        "url": "https://www.canada.ca/en/employment-social-development/programs/foreign-credential-recognition.html"
      },
      {
        "label": {
          "vi": "EU — ngành nghề có điều kiện",
          "en": "EU — regulated professions"
        },
        "url": "https://europa.eu/youreurope/citizens/work/professional-qualifications/regulated-professions/"
      }
    ]
  },
  "fields": {
    "eyebrow": {
      "vi": "02 — LĨNH VỰC CHUYÊN SÂU",
      "en": "02 — OUR SPECIALIST FIELDS"
    },
    "title": {
      "vi": "Chọn đam mê.\n*Mở lối tương lai.*",
      "en": "Choose your passion.\n*Shape your future.*"
    },
    "subtitle": {
      "vi": "Hai lĩnh vực. Nhiều hướng phát triển.\nMột hành trình được xây dựng từ bạn.",
      "en": "Two fields. Many paths to grow.\nOne journey shaped around you."
    },
    "items": [
      {
        "key": "healthcare",
        "theme": "healthcare",
        "kicker": {
          "vi": "01 / HEALTHCARE",
          "en": "01 / HEALTHCARE"
        },
        "symbol": "✚",
        "title": {
          "vi": "Chăm sóc\nsức khỏe",